{
  "owner": "Sameer-Bagul",
  "totalRepositories": 1,
  "lastUpdated": "2026-09-22T07:20:04.149Z",
  "repositories": [
    {
      "name": "skillkeys",
      "slug": "skillkeys",
      "url": "https://github.com/Sameer-Bagul/skillkeys",
      "status": "completed",
      "classification": "portfolio-worthy",
      "lastProcessedTime": "2026-09-22T07:20:04.149Z",
      "error": null,
      "fork": false,
      "archived": false
    }
  ]
}