{
  "owner": "Sameer-Bagul",
  "totalRepositories": 1,
  "lastUpdated": "2026-09-21T14:18:11.653Z",
  "repositories": [
    {
      "name": "NoteForge-AI",
      "slug": "noteforge-ai",
      "url": "https://github.com/Sameer-Bagul/NoteForge-AI",
      "status": "processing",
      "classification": null,
      "lastProcessedTime": "2026-09-21T14:18:11.651Z",
      "error": null,
      "fork": false,
      "archived": false
    }
  ]
}